"Nº de anexo","Nombre","Descripción"
"00","Desconocido","Desconocido"
"01","Anexo I","Tipos de Hábitats naturales de Interés Comunitario cuya conservación requiere la designación de Zonas de Especial Conservación"
"02","Anexo II","Especies animales y vegetales de interés comunitario para cuya conservación es necesario designar Zonas Especiales de Conservación"
"03","Anexo III","Criterios de selección de los lugares que pueden clasificarse como Lugares de Importancia Comunitaria y designarse Zonas Especiales de Conservación"
"04","Anexo IV","Especies animales y vegetales de interés comunitario que requieren una protección estricta."
"05","Anexo V","Especies animales y vegetales de interés comunitario cuya recogida en la naturaleza y cuya explotación pueden ser objeto de medidas de gestión."
